{
  "dataset_id": "dataset-reference-2026",
  "generated_at": "2026-01-01T00:00:00Z",
  "runs": [
    {
      "duration_seconds": 14.469,
      "executed_at": "2025-12-02T01:00:00Z",
      "gpu_id": "GPU-A",
      "iterations": 76,
      "run_id": "run-00000001",
      "status": "passed",
      "testcase_id": "TC-001"
    },
    {
      "duration_seconds": 17.059,
      "executed_at": "2025-12-02T02:00:00Z",
      "gpu_id": "GPU-A",
      "iterations": 67,
      "run_id": "run-00000002",
      "status": "passed",
      "testcase_id": "TC-001"
    },
    {
      "duration_seconds": 17.647,
      "executed_at": "2025-12-02T03:00:00Z",
      "gpu_id": "GPU-A",
      "iterations": 73,
      "run_id": "run-00000003",
      "status": "passed",
      "testcase_id": "TC-001"
    },
    {
      "duration_seconds": 17.46,
      "executed_at": "2025-12-02T04:00:00Z",
      "gpu_id": "GPU-A",
      "iterations": 75,
      "run_id": "run-00000004",
      "status": "passed",
      "testcase_id": "TC-001"
    },
    {
      "duration_seconds": 17.552,
      "executed_at": "2025-12-02T05:00:00Z",
      "gpu_id": "GPU-A",
      "iterations": 67,
      "run_id": "run-00000005",
      "status": "passed",
      "testcase_id": "TC-001"
    },
    {
      "duration_seconds": 13.701,
      "executed_at": "2025-12-02T06:00:00Z",
      "gpu_id": "GPU-A",
      "iterations": 63,
      "run_id": "run-00000006",
      "status": "passed",
      "testcase_id": "TC-001"
    },
    {
      "duration_seconds": 15.578,
      "executed_at": "2025-12-02T07:00:00Z",
      "gpu_id": "GPU-A",
      "iterations": 74,
      "run_id": "run-00000007",
      "status": "passed",
      "testcase_id": "TC-001"
    },
    {
      "duration_seconds": 13.76,
      "executed_at": "2025-12-02T08:00:00Z",
      "gpu_id": "GPU-A",
      "iterations": 70,
      "run_id": "run-00000008",
      "status": "passed",
      "testcase_id": "TC-001"
    },
    {
      "duration_seconds": 15.071,
      "executed_at": "2025-12-02T09:00:00Z",
      "gpu_id": "GPU-A",
      "iterations": 68,
      "run_id": "run-00000009",
      "status": "passed",
      "testcase_id": "TC-001"
    },
    {
      "duration_seconds": 15.977,
      "executed_at": "2025-12-02T10:00:00Z",
      "gpu_id": "GPU-A",
      "iterations": 72,
      "run_id": "run-00000010",
      "status": "passed",
      "testcase_id": "TC-001"
    },
    {
      "duration_seconds": 17.07,
      "executed_at": "2025-12-02T11:00:00Z",
      "gpu_id": "GPU-A",
      "iterations": 70,
      "run_id": "run-00000011",
      "status": "passed",
      "testcase_id": "TC-001"
    },
    {
      "duration_seconds": 14.275,
      "executed_at": "2025-12-02T12:00:00Z",
      "gpu_id": "GPU-A",
      "iterations": 77,
      "run_id": "run-00000012",
      "status": "passed",
      "testcase_id": "TC-001"
    },
    {
      "duration_seconds": 15.61,
      "executed_at": "2025-12-02T13:00:00Z",
      "gpu_id": "GPU-A",
      "iterations": 74,
      "run_id": "run-00000013",
      "status": "passed",
      "testcase_id": "TC-001"
    },
    {
      "duration_seconds": 14.613,
      "executed_at": "2025-12-02T14:00:00Z",
      "gpu_id": "GPU-A",
      "iterations": 69,
      "run_id": "run-00000014",
      "status": "failed",
      "testcase_id": "TC-001"
    },
    {
      "duration_seconds": 13.847,
      "executed_at": "2025-12-02T15:00:00Z",
      "gpu_id": "GPU-A",
      "iterations": 71,
      "run_id": "run-00000015",
      "status": "passed",
      "testcase_id": "TC-001"
    },
    {
      "duration_seconds": 16.724,
      "executed_at": "2025-12-02T16:00:00Z",
      "gpu_id": "GPU-A",
      "iterations": 62,
      "run_id": "run-00000016",
      "status": "passed",
      "testcase_id": "TC-001"
    },
    {
      "duration_seconds": 16.314,
      "executed_at": "2025-12-02T17:00:00Z",
      "gpu_id": "GPU-A",
      "iterations": 77,
      "run_id": "run-00000017",
      "status": "failed",
      "testcase_id": "TC-001"
    },
    {
      "duration_seconds": 16.971,
      "executed_at": "2025-12-02T18:00:00Z",
      "gpu_id": "GPU-A",
      "iterations": 73,
      "run_id": "run-00000018",
      "status": "passed",
      "testcase_id": "TC-001"
    },
    {
      "duration_seconds": 17.024,
      "executed_at": "2025-12-02T19:00:00Z",
      "gpu_id": "GPU-A",
      "iterations": 75,
      "run_id": "run-00000019",
      "status": "failed",
      "testcase_id": "TC-001"
    },
    {
      "duration_seconds": 16.309,
      "executed_at": "2025-12-02T20:00:00Z",
      "gpu_id": "GPU-A",
      "iterations": 68,
      "run_id": "run-00000020",
      "status": "passed",
      "testcase_id": "TC-001"
    },
    {
      "duration_seconds": 16.454,
      "executed_at": "2025-12-02T21:00:00Z",
      "gpu_id": "GPU-A",
      "iterations": 75,
      "run_id": "run-00000021",
      "status": "passed",
      "testcase_id": "TC-001"
    },
    {
      "duration_seconds": 17.067,
      "executed_at": "2025-12-02T22:00:00Z",
      "gpu_id": "GPU-A",
      "iterations": 60,
      "run_id": "run-00000022",
      "status": "passed",
      "testcase_id": "TC-001"
    },
    {
      "duration_seconds": 17.479,
      "executed_at": "2025-12-02T23:00:00Z",
      "gpu_id": "GPU-A",
      "iterations": 64,
      "run_id": "run-00000023",
      "status": "passed",
      "testcase_id": "TC-001"
    },
    {
      "duration_seconds": 14.007,
      "executed_at": "2025-12-03T00:00:00Z",
      "gpu_id": "GPU-A",
      "iterations": 63,
      "run_id": "run-00000024",
      "status": "passed",
      "testcase_id": "TC-001"
    },
    {
      "duration_seconds": 18.415,
      "executed_at": "2025-12-03T01:00:00Z",
      "gpu_id": "GPU-A",
      "iterations": 75,
      "run_id": "run-00000025",
      "status": "passed",
      "testcase_id": "TC-001"
    },
    {
      "duration_seconds": 14.623,
      "executed_at": "2025-12-03T02:00:00Z",
      "gpu_id": "GPU-A",
      "iterations": 67,
      "run_id": "run-00000026",
      "status": "passed",
      "testcase_id": "TC-001"
    },
    {
      "duration_seconds": 14.488,
      "executed_at": "2025-12-03T03:00:00Z",
      "gpu_id": "GPU-A",
      "iterations": 75,
      "run_id": "run-00000027",
      "status": "passed",
      "testcase_id": "TC-001"
    },
    {
      "duration_seconds": 18.395,
      "executed_at": "2025-12-03T04:00:00Z",
      "gpu_id": "GPU-A",
      "iterations": 68,
      "run_id": "run-00000028",
      "status": "passed",
      "testcase_id": "TC-001"
    },
    {
      "duration_seconds": 17.375,
      "executed_at": "2025-12-03T05:00:00Z",
      "gpu_id": "GPU-A",
      "iterations": 69,
      "run_id": "run-00000029",
      "status": "passed",
      "testcase_id": "TC-001"
    },
    {
      "duration_seconds": 17.299,
      "executed_at": "2025-12-03T06:00:00Z",
      "gpu_id": "GPU-A",
      "iterations": 75,
      "run_id": "run-00000030",
      "status": "passed",
      "testcase_id": "TC-001"
    },
    {
      "duration_seconds": 12.073,
      "executed_at": "2025-12-03T07:00:00Z",
      "gpu_id": "GPU-B",
      "iterations": 66,
      "run_id": "run-00000031",
      "status": "passed",
      "testcase_id": "TC-001"
    },
    {
      "duration_seconds": 11.548,
      "executed_at": "2025-12-03T08:00:00Z",
      "gpu_id": "GPU-B",
      "iterations": 60,
      "run_id": "run-00000032",
      "status": "passed",
      "testcase_id": "TC-001"
    },
    {
      "duration_seconds": 10.275,
      "executed_at": "2025-12-03T09:00:00Z",
      "gpu_id": "GPU-B",
      "iterations": 80,
      "run_id": "run-00000033",
      "status": "passed",
      "testcase_id": "TC-001"
    },
    {
      "duration_seconds": 13.025,
      "executed_at": "2025-12-03T10:00:00Z",
      "gpu_id": "GPU-B",
      "iterations": 76,
      "run_id": "run-00000034",
      "status": "passed",
      "testcase_id": "TC-001"
    },
    {
      "duration_seconds": 12.5,
      "executed_at": "2025-12-03T11:00:00Z",
      "gpu_id": "GPU-B",
      "iterations": 66,
      "run_id": "run-00000035",
      "status": "passed",
      "testcase_id": "TC-001"
    },
    {
      "duration_seconds": 11.382,
      "executed_at": "2025-12-03T12:00:00Z",
      "gpu_id": "GPU-B",
      "iterations": 74,
      "run_id": "run-00000036",
      "status": "passed",
      "testcase_id": "TC-001"
    },
    {
      "duration_seconds": 12.606,
      "executed_at": "2025-12-03T13:00:00Z",
      "gpu_id": "GPU-B",
      "iterations": 73,
      "run_id": "run-00000037",
      "status": "passed",
      "testcase_id": "TC-001"
    },
    {
      "duration_seconds": 12.832,
      "executed_at": "2025-12-03T14:00:00Z",
      "gpu_id": "GPU-B",
      "iterations": 69,
      "run_id": "run-00000038",
      "status": "passed",
      "testcase_id": "TC-001"
    },
    {
      "duration_seconds": 11.658,
      "executed_at": "2025-12-03T15:00:00Z",
      "gpu_id": "GPU-B",
      "iterations": 63,
      "run_id": "run-00000039",
      "status": "passed",
      "testcase_id": "TC-001"
    },
    {
      "duration_seconds": 12.251,
      "executed_at": "2025-12-03T16:00:00Z",
      "gpu_id": "GPU-B",
      "iterations": 68,
      "run_id": "run-00000040",
      "status": "passed",
      "testcase_id": "TC-001"
    },
    {
      "duration_seconds": 12.322,
      "executed_at": "2025-12-03T17:00:00Z",
      "gpu_id": "GPU-B",
      "iterations": 73,
      "run_id": "run-00000041",
      "status": "passed",
      "testcase_id": "TC-001"
    },
    {
      "duration_seconds": 13.662,
      "executed_at": "2025-12-03T18:00:00Z",
      "gpu_id": "GPU-B",
      "iterations": 62,
      "run_id": "run-00000042",
      "status": "passed",
      "testcase_id": "TC-001"
    },
    {
      "duration_seconds": 13.275,
      "executed_at": "2025-12-03T19:00:00Z",
      "gpu_id": "GPU-B",
      "iterations": 75,
      "run_id": "run-00000043",
      "status": "passed",
      "testcase_id": "TC-001"
    },
    {
      "duration_seconds": 11.919,